,Beer Names,Rating,Locations,Reviews,Users
683,Lagunitas Super Cluster ,2.1,"Petaluma, California","Can sample at a tasting at Tom L's place. Thanks Odi. Clear golden, white head. Stale hops, oxidation, cardboard, honey, sweet, bitter finish, a bit of alcohol.",DSG
684,Tree House Autumn,2.3,"Charlton, Massachusetts","16oz can.  Pours an opaque pale yellow with a small white head.  Aroma is orange, pineapple, dough, grass, and a little pine.  Taste is orange, pineapple, oats, vanilla, pine, peach, dough, and a little grapefruit.  Skunky finish.  Pine lingers.  Light-medium body.  Moderate carbonation.  Oily-chewy mouthfeel.",tapefuzz
685,Fremont Sky Kraken,1.5,"Seattle, Washington","Pine and resin, some citrus, barely any malt. This beer is reminiscent of others in it's category; that is low abv IPA's, the overall body of the beer is lacking in malt flavor and bitterness while the taste of hops overpowers anything else worthy of attention. Not the worst beer I've had but definitely not good by any standards.",njarmer
686,Moerlein Bay Of Bengal,0.9,"Cincinnati, Ohio","From a Kroger can this pours a little darker than average pale and it seems to be quite thick. Big fruity rude aroma with a mild cleaning pine fluid nose. Taste is big bad-ass and bitter. BBAB! I second that with an upper gullet warming sensation. Its near the big ten; and you feel it. In the end, is it possible I detect some sensations of unthinkingly dizzy. Whew. What else can be said? One bitter straight up ass, terribly on style, IPA IPA  brew. There you have it, another ubiquitously available style, duh.",cheap
687,Farsons India Pale Ale,4.0,"Mriehel, Malta","Jasne złote klarowne, niska ale fetą i trwała piana. Aromat chmielewy, cytrusowy fajnie pachnie. Średnia goryczka, pijalne. Średnie niskie wysycenie, porządne piwo",gaara1221
688,Yards Philadelphia Pale Ale,5.0,"Philadelphia, Pennsylvania",First tried this while on vacation on tap at a bar.  I fell in love!  I don't think I will ever drink another brand!,DraftLove45
689,Ludlow Gold,5.0,"Ludlow, Shropshire","Lovely look, aroma and great tasting beer. 
There are good beers out there but I feel this one is out there with them. A great cask and great in bottles too.",HopsSampler44
690,Dinkelacker Volksfestbier,4.4,"Stuttgart, Baden-Württemberg","Marketed as ""Okotoberfest Marzen"" here in the United States. Sampled at the Bier Stein, Eugene, OR.",bpreo
691,Blackberry Farm Let There Be Silence,1.1,"Walland, Tennessee",This quad tasted more like a sour.  I couldn’t drink it!  It was the worst quad I’ve ever had. Just wasted $20.,DraftSampler34
692,Cigar City Oatmeal Raisin Cookie Brown Ale,1.3,"Tampa, Florida","Canned, from Systembolaget.  Dark brown, small head. Aroma of well, oatmeal raisin cookie. Sweet with medium body and clean, sterile mouthfeel. Tastes like... Oatmeal raisin cookie. Low bitterness in a finish with some tin foil. Oh, the refinement. I've always dreamed of liquid raisin cookie in tin foil. And the complexity!",omhper
693,Collective Arts Collective Project: IPA Project #10,1.9,"Hamilton, Ontario","Tall can from grocery store. Smells fruity and well hopped, pours golden with ample head. A bit murky, but that could be stylistically appropriate. Thin and dry, with too little malt/sweetness to counter the hops. Found it too unpleasant to drink.",AllGrainExports40
694,Brew By Numbers 11 Session Black IPA,1.6,"Bermondsey, Greater London","440ml can, but 4 days out of date.  Murky dark brown. Aroma of dark malt and metallic notes.  Dark sugars in the flavour with damp malt.  Considering it had only just gone out of date, this beer was in a bad way.",Beese
695,Moerlein Big Hazy IPA,1.3,"Cincinnati, Ohio","From a can you get a surprisingly clear liquid (considering the name, heheh) with a big foamy pour. It has just a very slight haze but no way is this hazy. No real offensive IPA smells in this one. Taste is big bad IPA of course and possibly it has a bit of an aged feeling to it. Date code is CMB1 9198 2361, whatever that means. Yes, big bitter IPA bullshit, like any other of the thousand ubiquitous IPA out there. What else can be said? NOTHING. Oh well, so goes the tick. Not impressed.",cheap
696,Berliner Kindl Weisse Mit Schuß Waldmeister,4.0,"Berlin, Berlin","Valójában egy ízesített nyáron jól Iható sör , azonban kicsit túl tolták benne az aromát és talán a savakat. Lehűtve viszont üdítőnek kiváló.",ignaczbence
697,Tennents Super ,5.0,"Luton, Bedfordshire",I frikkettoni (hipster et similia) oggi bevono acqua e sapone (v. IPA). Andatevene affanculo.,BarleyMaestro45
698,Abita Honey Suckle Saison,1.6,"Abita Springs, Louisiana",Yellow pour with zero head. Aroma is odd and medicinal. Has a weird flavor of unknown spices. Kind of tastes like a Band Aid smells. Strange numbness on the palate. Little to enjoy here. Bottle.,pkbites
699,Tree House In Perpetuity,2.4,"Charlton, Massachusetts","16oz can.  Pours a hazy pale gold with a tiny white head.  Aroma is pineapple, mango, dough, some orange, and light pine.  Taste is dough, papaya, candied mango, yeast, pepper, some orange, and pine.  Some grapefruit in the finish.  Dry finish.  As it warms, the citrus moves more to the front.  Light-medium body.  Medium carbonation.  Oily, thin mouthfeel.",tapefuzz
700,Jennings Cumberland (Bottle),0.8,"Cockermouth, Cumbria","Tastes like cucumbers and bleach.  I like a huge range of beer styles, including (good) English bitters,  but how anybody can drink something like this is beyond me.",alassio
701,Heberbräu Krawandorfer,1.6,"Kirchenthumbach, Bavaria","""Heberbräu Krawandorfer"", 5 %, Flasche (MHD: 5.12.19) von Heldrichs Getränkeeck, Edelsfeld. - Hell goldbraun, schwach trüb. - In der Nase leicht karamelliges, bonbonsüßes helles Malz, grüne Äpfel, chemische Zitronigkeit, Hefe. - Antrunk übersüß hellmalzig mit greller Fruchtigkeit (grüne Äpfel, Zitronenschorle). Knallig süßsäuerliche Bonbonaromen, Anklänge an Putzlumpen. Im Hintergrund etwas rauhe, wenig aromatische krautige Hopfenherbe. Stark rezent. Im Abgang immer noch süßsauer mit leerer Bittere. Ranziger Nachtrunk. - Mißratenes Landbier mit greller, scharfer Zitrone, zu süß und derb bitter. Ungenießbar. (21.9.2019.)",Moravius
702,Falls City Beer,4.1,"Pittsburgh                      , Pennsylvania","Falls City Classic Pilsner has a medium, creamy, off-white head, an odd, murky, gray-gold appearance, and some glass lacing. The aroma is strange- Belgian spicy yeast. The flavor is likewise strange, but bitterness is in play. Mouthfeel is medium, and Classic Pilsner finishes on the dry side. RJT",ronaldtheriot
703,Ras L'Bock Bam Bam IPA,1.0,"La Pocatière, Quebec",Just bought this directly at the brewery....found it very bad.  The ginger taste is too present and does not go well with the citra.,matsgone
704,EKU 28,4.9,"Kulmbach, Bavaria","Doppelbok de 11 % abv.
Mon exemplaire était à 6 mois avant sa date.
(bouteille longtemps attendue, curieusement, puisqu'on en parle partout …).
Couleur roux aux reflets lie de vin, et à la clarté pure, limpide.
Bulles fines, en colonnes droites, vives.
Mousse inexistante, liquide pareil à un beau vin.
Arômes de résine de pin sélectionné, prune blanche, kir, amandes blanches.
1ère bouche vivace, avec une superbe entame vin fortifié, mirabelle.
Arrière-bouche longue, bien vinifiée.
2ème bouche qui trouve des nuances de sherry marquées, et de cerise blanche.
Arrière-bouche stylée, nette, à la définition pure.
Longueur à la texture trop pétillante, et qui ne trouve plus de nuances très nobles.
Jambes lisses, longues.
Levure fine, très belle ligne.
Alcool serré, sans concession, mais on peut le dompter .. ceci dit, c'est lui qui
sera la cause de la non présence de cette bière dans le top ...
Finale forte, très longue.
CONCLUSION : une belle bière, mais dont la longueur témoigne d'un certain
manque, caché sous le niveau abv .. assez hard !!
Mais il y coule indiscutablement de l'esprit .. peut-être pas doppelbok ..
J'ai longtemps hésité à la coter au top .. parce qu'elle a un véritable gnac.
(écoute conseillée : mes amours de cette année, les Black Mirrors belges …
que vous pouvez écouter au Rockpalast en 2017 … déjà … à Bonn, ex-capitale,
et dont le guitariste possède une extraordinaire Strato beige, d'enfer ...
de la musique à 11 % abv bien tapés … qui eux sont à 5)	(10/5/10/4/20)",corkyrory66
705,Brewhouse Alta Lake Ale,1.2,"Whistler, British Columbia","Medium clearish copper body and small foam, very vague watery caramel on the nose. Flavour is weak caramel, and I mean really weak. Double the density or something, this stuff is just too watery.",DeanF
706,Northern Monk Neapolitan Ice Cream Pale,1.0,"Leeds, West Yorkshire","Too sicky for me, must be the strawberry.. didn't enjoyed and was even hard to finish it.",ni_en_pedo
707,Blue Moon Mango Wheat,4.8,"Denver, Colorado","Excellent, I love mango. Light body, few foam and lace, quenching after 10 mins walk from home to H-E-B. 
Absolutely will drink again",beer3000
708,Golden Road Haze the Day IPA,1.2,"Los Angeles, California","Ha, Ha, right out of the can I thought I was getting a hazy session IPA but hey, its a slight haze but not session.  Well, maybe its a session of yer a serious IPA lover, wink, wink.Big thick craggy head. Penetration flavors that could never be refreshing. Who wants a preservative in their beer? See here!  WTF with these IPA beers, they all taste the same and they all have different names; hah, and there must be a gahzillion of them. Happy bussyshit. Slight warming sensation thru the gullet. Difficult. What eles can be said? Terribly on style, why sher: right up thar wittah best IPA's 'round. Go get it IPA beer nut, I mean coconut.",cheap
709,Cerne Abbas Tiger Tom ,1.5,"Dorchester, Dorset","The 3rd and last in the Ginger trilogy, first off they've got the name wrong. It should of course be called Sabre Tooth Tiger Tom after Britain's greatest ever war hero, a veteran of too many campaigns to count, leader of the Minxy Little Tricksters and inventor of smoking ""the army way"" What a shame then that this beer has less body than a string vest, it's described as a mild, which again is the last thing you'd call S.T double T. It's a metallic tasting thin drink that reminds me of home brew, urgh. Get that n☆p!",ThePaleAlien
710,Whistler Chestnut Ale,1.4,"Whistler, British Columbia","Clear copper body and little foam, sweet fake chestnut syrup on the nose. Flavour is just a pile of cloying chestnut syrup blended into overcarbonated soda water. The fakest of fake beers.",DeanF
711,Ringwood Fortyniner (Cask),4.8,"Ringwood, Hampshire","Excellent pint of fortyniner at the hoggett, Hook, Hants. Wonderful deep colour and balanced maltiness and bitterness. Rescued my tastebuds after a terrible pint of Marstons 61 deep!",BrewTun38
712,Marston's 61 Deep (Cask & Keg),1.0,"Burton-on-Trent, Staffordshire","A terrible, excessively hoppy american style ale. It is rare that I have to pour an ale away if it's not actually off, but it did with this awful stuff. Marstons - you know better than this! Stop it! At least label it as what it is so people like me can avoid it!",BrewTun38
713,Paulaner Hefeweissbier Alkoholfrei,4.1,"Munich, Bavaria","Amber hazy with a frothy head.
Strong smell of wheat. Taste sweet and wheaty with some bitterness and acidity. Lemon note. Low carbonation.
This is a nice low alcohol Weißbier.",ophone
714,Farsons Blue Label (3.3%),4.2,"Mriehel, Malta","Obfita piana, mega gładka i trwała, klarowne złote rubinowe. Aromat nikły z słodowy, mleczny. Bardo gładkie, pijalne, niska goryczka ciekawe",gaara1221
715,Strongbow Cloudy Apple,5.0,"Hereford, Herefordshire","Just lovely. 
Right amount of sweetness coupled with a crisp aftertaste. 
Definitely recommend a couple of chilled glasses on a sunny evening.",LocalChalice26
716,Brickway Oktoberfest,0.8,"Omaha, Nebraska",Frothy. Worst Octoberfest I have ever tasted.  I love this brewery but my gawd after the hacker pchorrs to this...,hoger
717,Tampa Bay Gourds Gone Wild Pumpkin,1.5,"Tampa, Florida","What the hell? This beer is getting a 97 overall on ratebeer? Dang, I must really be out of it. Of course, its a given that I'm not crazy about pumpkin beers to begin with, but I can still usually drink them. This one, though, was a drainpour. Something about the taste of a baked pumpkin with a very pronounced bitterness over a semi-dry malt just doesn't work - at all. My wife even said it smelled horrible as I poured it out and she complained she'd have to clean the sink. I didn't really spend too much time analyzing this, so I don't have a ton more depth to provide. Two sips was enough to convince me to dump it. But it had a good enough mouthfeel if you ignore the flavor, and it looked fine, so I can't ding it on those two dimensions.",PhillyBeer2112
718,Farsons Hopleaf Pale Ale,3.9,"Mriehel, Malta","Głęboko złota barwa, bardzo fajna piana, raczej klarowne. Aromat chmielu z ale raczej ziolowy i trawiasty niż cytrusowo żywiczny. Średnia goryczka, jakiś tam posmak skórki cytrusow, trawa cytrusowa, chmiel. Pijalny Ale ale bez szału.",gaara1221
719,Upstream Firehouse Red Lager,5.0,"Omaha, Nebraska",This my favorite beer....period.  I worked in Omaha for a few months and drank this beer every night.  I only wish it was distributed.  Can’t get it in NC.,AllGrainRespek42
720,Spaten Optimator,2.0,"Munich, Bavaria",The darkest one of the variety. Lots of malt. Reminds me how much better American beer is than European. They beat us on tradition but their beer has been outdone by American microbrews.,Chadhami
721,Woodgate Pear Cider,0.5," Wimbledon, Greater London",Here we have another universal credit budget drink... Again as the last woodgate review this alcoholic beverage is a cut about the usual. Apple cider... This one is made from tinned pears and possibly brown sugar the kind of drink you would find in the hands of some embarrassing uncle with a Georges shirt on trying to fit in with the lads an abomination of a drink that will open the flood gates if your feeling blocked up....,Fozzymcaddict87
722,Woodgate Dry Cider,0.5," Wimbledon, Greater London","The kind of drink that would be welcome to the local community jakey or tramp outside of greggs, the price is cheap, the taste is cheap and overall its a poormans strongbow...",Fozzymcaddict87
723,Carolina Bauernhaus 18 Mile Red Grand Cru,0.6,"Anderson, South Carolina","500-ml bottle from rare beer club. no real head just an island of bubbles, murky reddish cola color, sour nose, super sour, not balanced like a flanders, could imagine wine, medium body.",zebra
724,Altenmünster Brauer Bier Urig Würzig,4.6,"Kempten, Bavaria","I Absolutely LOVE THIS Bier! They USED to carry this brew at the Walburg Mercantile German Restaurant & Biergarten in Walburg, Texas. Frankly I am Really pissed that they stopped carrying this Awesome Nectar! I have only been there 2 or 3 times in the last 15 or so years for this one simple fact...",HopsAromas35
725,New Holland Dragon's Milk,2.3,"Holland, Michigan","New to craft beer and saw this was a must get in the stout category. Unfortunately I was not a fan of the bourbon aspect  and couldn't get past the heavy alcohol taste. Maybe after trying more stouts I'll gain an appreciation, but for now I wouldn't say this a great beer.",SourReports35
726,Karbach Hella Chella,1.0,"Houston, Texas","yeah, dont drink this no matter how cheap if is. tastes like salt water mixed with flat beer",kidmartinek
727,Traugott Simon Kölsch,0.5,"Krefeld-Linn, North Rhine-Westphalia","Kolsch de 4,8 % abv, au seul malt d'orge et extraits de houblon.
Mon exemplaire était à 5 mois avant sa date.
Couleur doré soutenu.		
Bulles fines, en colonnes droites, peu nombreuses.
Mousse blanche, à gros flocons, instable.
Arômes de plâtre, colle à bois.
1ère bouche pétillante, totalement synthétique.
Arrière-bouche aux nuances de pneus dégonflés.
2ème bouche totalement artificielle, factice.
Arrière-bouche qui arrive au frelaté ...
Longueur sans relief, si ce n'est négatif …
Jambes courtes.
Alcool nul, sans intérêt, il poisse cette bière.
Finale nullissime.
CONCLUSION : une nullité sans pareille, cette kolsch (qui n'en est pas une ..).
En d'autres termes un trou sans fond , réalisé pour la chaîne "" Trinkgut ""
qui porte donc très mal son nom !!",corkyrory66
728,Gilden Kölsch,1.2,"Cologne, North Rhine-Westphalia","Kolsch de 4,8 % abv, avec malts d'orge et de blé.
Mon exemplaire était à 4 mois avant sa date. 
Couleur doré moyen, à la belle brillance.
Bulles fines, en colonnes droites, très peu nombreuses.
Mousse blanche, qui se réduit vite, stable à 1 mm.
Arômes d'aubépine, thé de tilleul, pointe d'amandes douces.
1ère bouche axée sur une pils, avec une amertume sèche.
Arrière-bouche qui trouve vite de l'astringence.
2ème bouche faible, très faible, quoique légèrement aromatique.
Arrière-bouche qui rejoint la pils à papy.
La longueur ne donne rien de mieux, ni rien d'autre.
Jambes à flocons moyens, très courtes.
Alcool faible, désintéressé à travailler les saveurs.
Finale linéaire, voire inférieure (encore).
CONCLUSION : on ne sait pas si Gilden fait référence à une éventuelle guilde
des brasseurs, mais c'est strictement navrant … (2/2/2/2/4)",corkyrory66
729,Kestrel Super Premium Lager,5.0,"Bedford, Bedfordshire",Drank once from a can. Savage night followed it hence the 5*. Memories made from an elite sesh.,tain.r.farrelly
730,Montucky Cold Snack Beer,4.2,"Bozeman, Montana","*Disclaimer* I understand that this isn't a craft beer but in a world of PBR's, Hamm's, and whatever else, I'd take this over them any day. It's a beer I could drink all day. 

Once again, not a craft beer. In my opinion it's the best of the less refined beer.",MeadTrub36
731,903 The Chosen One Coconut Ale,4.5,"Sherman, Texas",903 Brewers The Chosen One 6.8 % ABV 35 IBU. This cream ale pours a clear golden yellow color with a finger length slightly off white colored head that hangs around for a bit before dissipating leaving some lacing on the glass. The aroma is of coconut with a massive grain backbone with a hint of lemony citrus aroma. The flavor is sweet with the grain flavor coming through before giving way to a delicious almost toasted coconut coconut flavor before finishing with a slight hoppy bitterness to offset the sweetness of the grains and coconut  it also finishes with more coconut. The mouthfeel is creamy with the perfect amount of carbonation definitely not to thin or thick spot on with the mouthfeel. 8/10,Sexy_texan18
732,Ace Pineapple Cider,5.0,"Sebastopol, California","Great Taste. If your saying it has no head, IT'S A CIDER, IT'S NOT SUPPOSE TO HAVE HEAD LMFAO. Have had both on Tap and in a Bottle., both are great but Tap is always better. I definitely get the Pineapple and also get a strong White Gummy Bear after taste. This is very smooth with little to no bite at the end of the drink. This is tied for the best Cider I have ever had. It is VERY SWEET, something I like but not everyone does. Ciders over Beer here!",MashScout42
733,Blue Moon Belgian White Ale,4.5,"Denver, Colorado",This is my go to beer. I love the wheat beers with the slight orange flavor,benjamin921
734,Valaisanne Pale Ale,1.1,"Sion, Switzerland","Bottled in Zurich at recelette factory with a plate of Heidi ?, basically melted cheese, potatoes and pickle.  It contains alcohol, presumably local, but otherwise unremarkable.",mephisto
735,Cycle Thursday - 2018,2.3,"Saint Petersburg, Florida","22 oz. bottle, pours a motor oil black with a small tan head. Aroma smells sour, with roasted malt, bourbon and sour notes. Flavour is vinegary and sour - ugh, this is infected. Not much bourbon or any pastry goodness. Surprising a Cycle BA stout would be sour-infected. Poor.",mcberko
736,Sweetwater Guide Beer A Lager,5.0,"Atlanta, Georgia",I love the design of of the can and each description. The flavour profile described on the can is accurate as always with sweetwater. It's one of my favorites from sweetwater.,radcowdisease
737,Detmolder Herb,0.5,"Detmold, North Rhine-Westphalia","Schnell zerfallende, großporige Schaumkrone. Leichter Malzgeruch eines leicht trüben, gelben Pilseners. Spritzig-herber Antrunk. Leicht malziger, wässriger Körper, der schnell von einer stark metallischen Herbe abgelöst wird, die den Körper und Abgang total dominiert und in einem modrigen langen Nachhall endet. Nicht langweilig, sondern schlecht, lieber nie wieder.",L.Kehrseit
738,Miller High Life,5.0,"Milwaukee                       , Wisconsin","Very nice beer! This is the kind of beer that is a good beer to drink, when you want to drink a good beer. I reccomend drinking this beer, highly!🍺",karlmarx69420
739,Unveiled Double IPA,1.1,"Novato, California","SO, you just can't get away from these IPA. You go to find new untasted beers and what's the majority? You got it. So I'm expecting some alky soaked  random ubiquitous viscous bitter brew from start to finish. And it looks like t is. It also has a big fat head. Clear pale. Terribly on style IPA, what else can be said? Why would anybody ever put this many hops in a beer? To preserve it? Who wants preservatives in beer, we can trust our canning abilities in this day and age.",cheap
740,LaBieratorium F60 Paranoid IPA,1.1,"Cottbus, Brandenburg","Sept 2019  330ml dark bottle, unfiltered, from Beer52. Poorly designed and printed label - like an amateurish attempt at a Grateful Dead album cover. I struggled to make out the name. Beer is a sludgy amber. Quite hoppy with baby vomit aroma. Strong, very sweet malt. This is rather crude and simplistic. Rather like an over-enthusiastic and clumsy first time home brew. Not good.",SilkTork
741,Cerne Abbas Ginger Fox,0.5,"Dorchester, Dorset","One of a trio from this brewery gifted by Red of Basildon. Quite simply this is one of the foulest, bad-tasting, nastiest drinks I've ever had. I really cannot overstate how unpleasant this is, it is thinner than a supermodel on the 14th day of a fortnight's fasting and the only ginger thing worse than this sang with the Spice Girls. Please, please avoid. The Queen is dead boys.",ThePaleAlien
742,Wychwood King Goblin  (Bottle),4.9,"Witney, Oxfordshire","Beautiful strong ale. Vanilla niceness, mellow and cheerful, enjoyed consuming this",topherwalk
743,Augustiner Edelstoff,4.7,"Munich, Bavaria","Das Bier kenne ich von diversen Reisen nach München, wo es natürlich im besten im Augustiner Bräu beim Hauptbahnhof mundet. Es ist ein wunderbar ausgewogenes Bier, bei dem einfach alles passt. NIcht zu einfach, nicht zu abstrus. Solide und doch wunderbar erfrischend. Das kann man immer wieder trinken. Auch wenn in manchen Bobo-Restaurants außerhalb Bayerns ordentlich dafür verlangt wird.",NobleSampler19
744,Four Loko Grape,2.7,"La Crosse, Wisconsin",24 oz. can poured a clear purple with a lingering ring of bubbles. Aromas of grape soda pop. Palate was light bodied and crisp. Flavors of grape soda pop with a crisp dry lingering artificial grape finish.,Ratman197
745,Rivet Lager,5.0," , North Rhine-Westphalia","Not meant to be chilled! Must be consumed just below room temperature. Room temperature is fine too. 
Tastes and smells like lychees, has a faint bitterness to it, mostly flavours and little bitters. Hands down one of the best beers I’ve ever tried. Aftertaste is alright. Don’t waste your money on all those marketing bs beers! This beer is brewed to taste good in the temperatures of Vietnam. There were no refrigerators in Vietnam when they started brewing! The cold suppresses sweet flavours so room temperature is best for drinking!",FlightTrub27
746,Lone Star,5.0,"Los Angeles, California","Zajebiste piwko! Smakuje jak połączenie nektaru z orgazmem. Gówno prawda, to piwo to szczyny",NobleMonger43
747,Bintang Radler,3.6,"Central Java , Indonesia","I don’t know what I was expecting, but this is is better than the Millers Chill. Quenches your thirst without getting pissed.",TrappistExports39
748,Cool Beer Stonewall Light Lager,4.0,"Toronto, Ontario","delish easy drinking lager, in a world of unbalanced hop heavy craft beers, this is an absolute guilty pleasure on a hot summer day. Well done Cool Beer Co.",SourTun36
749,Miller High Life,4.8,"Milwaukee                       , Wisconsin","My favorite mass produced beer, slightly sweet, non offensive, well balanced. I could drink this all day.",SourTun36
750,Fuller's ESB (Pasteurised),2.0,"Chiswick, Greater London","Fazla olmayan değişik koku, sarı gövde. Çok fazla aromaya sahip değil olan aroması da stout biralara benziyor. Çok tutmadım
",dzenkalpic
751,Fuller's Wild River,1.6,"Chiswick, Greater London",Küf kokuyor. Tadında çok alkol alınıyor.Köpüğü fazla. Asitliği de fazla. Gövde sarı. Beğenmedim.,dzenkalpic
752,Funky Buddha Blueberry Cobbler,0.8,"Oakland Park, Florida","Can't believe the high ratings this swill has gotten.  Absolutely abominable, possibly the worst beer in the history of the industry.  And i say that as a huge fan of Funky Buddha products.  I bought it as part of a 12 pack and choked down two of the three cans that were included.  Gagged so badly just dumped the third out.  Terrible. I can't think of three more hideous flavors for beer than cinnamon, vanilla and blueberries.  Seriously, this is like some kind of prank by devious brewers.",SourRespek38
753,McEwan's Champion,5.0,"Bedford, Bedfordshire","To be drank with care.
This a a top rate high strength beer that is just fantastic. To be sipped so you have to use a bit of self control if you are a normal beer drinker. I will always have a couple of bottles in. Brilliant value now in supermarkets.",SourTapper56
