,Beer Names,Rating,Locations,Reviews,Users
1082,Pabst Blue Ribbon Hard Coffee,1.1,"Los Angeles, California","Skinny 11oz can (just another way to suck money from you) reminiscent of an energy drink.  Nose too-sweet coffee and cream, sugar, and malted milt balls.  Pour creamy as any coffee drink, opaque pale mud, color actually very close to the lighter brown on the label of the can, with no head.  Very sweet in the mouth but not cloying, does have an artificially-boosted character, sort of a stevia instead of cream addition; essentially chocolate milk with a wisp of low-grade robusta and a melted Whopper.  Body extremely thin and watery, no bitterness, hint of drying out and even astringency, no alcohol, hint of flimsy dirt.  Really no stout/beer character here to speak of, this is the equivalent of a cash-grab Frappuccino for brand loyalists only.  [2019.08.06: 1.1]",ganache
1083,Mispillion River Pineapple Express,1.2,"Milford, Delaware","Ok, this can says pineapple and I'm initially thinking NO, not another weird fruity beer. But now I see its listed as just another IPA, HAH, almost as bad, heheh. Smells like a fruity volatile beery drink with a tad of some IPA olfactory. Chunks in the bottom of the can spill into the mug. Fairly pale and quite hazy but not like a NEiPA. Terrible big rude ass taste. During the session it truely tries to impress with guts big straight up biting bitter ass. In the end, its just another ubiquitous one in a million IPA, what-ever. Yes terribly trashy and a single testicle. Thundercunt I say! Approaches bouble IPA territory.; such an  idiot and twat. Go for it Mr double set of twatlips. You love it, drink it down, twatwaffle. Hey, if you are looking for anything pineapple in this; forgetttahbouttitt. Call it derailment double imperial if you want.",cheap
1084,Mad Hatter Tzatziki Sour,1.6,"Liverpool, Merseyside","Keg (Eebria Taproom, Bermondsey) (3:2:3:2:6=1.8)
Cloudy and pale. Cucumber aroma. Cucumber taste. Tart sour palate. Oh, just fuck off, this isn't beer this is a pisstake. A trash kettle sour.",FatPhil
1085,Rainier,5.0,"Los Angeles, California","A smooth beer without tasting or feeling watered down or tasting bitter. The can in the picture doesn't look like the standard beer can. I probably prefer regular Rainier beer over any lighter beer that I have had in recent memory, all of which were either bitter or weak or watery.

Another favorite beer was Hakim Stout, which is not stout-y, but it seemed to have changed in the past year; it can be found at some Ethiopian restaurants, sometimes even if it is not on the drinks menu.

I am not much of a beer drinker, and have a hard time drinking any because of the bitterness.",WortLiquids47
1086,Mill Street Original Organic Lager,5.0,"Toronto, Ontario","I disagree with most of these reviews. This is a refreshing organic brew. Goes down smooth & clean, no bitter aftertaste, a smidge on the sweet side.",BarleyTasty40
1087,Heineken,4.1,"Zoeterwoude, Netherlands","A little bit watery but not corona/Budweiser watery but still it's a pretty good beer.

But buy the bottle version tastes a little bit better.",oleanders
1088,Odd Side Pineapple Dank Juice,1.6,"Grand Haven, Michigan","So here we go again, another ubiquitous high alky IPA, I need to stop buying these asshole beers, just for tick? WTH?  $2 for a minimal labeled can. From vintage. Pour is slight haze on pale. Big foamy head going into crag. Alarming sweet hop, maybe some fruit, olfactory attack. Taste is simple big bitter biting balls BUNGLING BUNK & BURDENSOME.  BURDENSOMELY busted, that is.  Such a 
BUSYBODY BAGDAD BUTCHER. There you have it. If you like IPA, the lower my rating, the better for you, you terrible bittier hop beer person. I was hopen' since it was odd side, it would be at least a little tart, but noooooooooooooo!!!! Its straight away IPA, like any other, just change the bullshit hop flower type and then call it a totally new beer? Get off my cloud and yes this was written by a self proclaimed unadulterated beer snob. Check out that;  CHI-NAHH! No definite sign of pineapple in this massively and arrogantly bitter brew.",cheap
1089,Omega White Cider,4.7,"Birmingham, West Midlands","Its probably the best white cider going.
drink the others if thats all i can get but omega is the best,and it seems to be a good price too",TrappistRates31
1090,Florida Beer Key West Sunset Ale,4.4,"Cape Canaveral, Florida",On tap at Sheraton hotel in Orlando. Really a solid beer it’s not an A but it’s a B+ for the style in my book. Smooth.,smayor14
1091,Redchurch Hoxton Stout,1.7,"Harlow, Essex","nez métallo-torréfié, bouche moussue vulgaire (étouffe), pas franchement agréable en dégust’, best before 17 mois)",julesxxl
1092,Founders Backstage Series # 1: Blushing Monk,1.9,"Grand Rapids, Michigan","Rami Rami is drinking a Blushing Monk (2019) by Founders Brewing Co. at Mikkeller Bar Warsaw

Syrop owocowy z biedry w ilosci kosmicznej. Slodki. Niedobry. Kurde, jakim cudem to ma taka srednia?",rami_pl
1093,Nickel Brook Cucumber Lime Gose,0.5,"Burlington, Ontario","Horrible foot aroma, extremely forward cucumber flavour, almost like it was a concentrate. Taste like compost completely undrinkable. Extremely disappointed by this beer.",TasteMaestro25
1094,Bellwoods White Picket Fence Foeder Blended Saison,1.4,"Toronto, Ontario",Taste like soap if u like soap it's great don't know these reviewers were thinking deadful,BarleyHopper25
1095,Odd Side Ales The Stinger,1.1,"Grand Haven, Michigan","

Can from vintage, $2, minimalist label. Looks like a shade pale hazy IPA. Smells like IPA, no lie. Now with honey? Isn't double impy IPA already too sweet? Come on now. Nice creamy head. Taste is simply big fat straight up ass FTW bitter bastard. Mouth coating monster, rude ass renny, kick ass kenny. Feels like new stitches on the inside of your mouth just before it rototillers and plows its way to the gullet. Whew. Probably could be a few more alky percenters for an impy double -  dude. Could not appreciate. Yea, no sign of honey in this stuff. 
",cheap
1096,Offshoot Relax [It’s Just a Hazy IPA],2.0,"Placentia, California","473ml can. Hazed murky pour. I hate hazy ipas but they get this one especially wrong, its orange juicy but with the flattest yeasty malt note that makes it a chore to drink.",crossovert
1097,Brewery Bhavana Grove,2.2,"Raleigh , North Carolina","473ml can. Generic hazed pour, generic juicy hazed nose, generic hazy flavor, why the heck is another boring neipa in the chicago market? Bring back west coast now.",crossovert
1098,Pabst Blue Ribbon Extra,1.1,"Los Angeles, California","473ml can. Gold pour, this one smells putrid, boozy pbr, flavor is same as pbr with a booze blast, stick with an icehouse or something.",crossovert
1099,Wild Beer Nebula,1.6,"Shepton Mallet, Somerset","dorata, torbida, schiuma abbondante e bianca dalla buona tenuta. al naso bubble gum, medicinale, vegetale. ossidazione. brutta storia. in bocca lieve fruttato. corpo vellutato, watery, carbonazione bassa. amaro inesistente.",Diabobale
1100,Hap & Harry's Tennessee Lager,4.0,"Nashville, Tennessee",Pour is orange gold with a thin lace around the rim. Sweet hop and malt smell. Citrus taste with a sweet palate.,Susie33
1101,Twisted Barrel Saison from a Hoppy Place,1.0,"Coventry, West Midlands",rough and tasted very similar to the hefeweizen - wanted to poor it down the sink,BarrelRespek40
1102,Siren Medjuica,1.9,"Finchampstead, Berkshire","* Bottle 4.8%, IPA. 
* Appearance is cloudy golden with a white dissipating head. 
* Aroma is strong, earthy, tropical fruits, melon, passion fruit.
* Palate is medium body, very high carbonation, with fine bubbles. 
* Taste is strong, off melon flesh, apricot and pine.
* Finish is bitter, slightly sour, drying.
* Overall strong off melon flesh, apricot and pine taste, drying, 2/5.",MrJamesMcEwan
1103,Martens Gold,3.3,"Bocholt, Belgium",500 ml can purchased in Martinique. Pours a clear light gold color with a white head and great retention. Good lacing. Light grain aroma. Light Euro lager flavor. Soft mouthfeel. Decent generic lager.,Kleg
1104,KEO,5.0,"Lemesos, Cyprus","Beautiful lager, got me out of the worst of hangover situations, a true friend. Best served out of a warm can on a balcony with a stupendous breeze. The 1st, 2nd and 3rd are ‘ok’ - but it is genuine heaven at number 11. Highly recommended.",FoamMeister30
1105,Keystone Light,4.0,"Golden, Colorado","My favorite light ""water beer"". Very refreshing on a hot day and you can pound them. Light grain and corn aroma and taste.  Rated against other beers in the same class.",WortTickers45
1106,Natural Light,5.0,"St. Louis, Missouri",A homegrown American brew for drinkers of any age. You could drink natty hot and its still a pleasurable experience,BarleyLees34
1107,Brand Session IPA,0.5,"Wijlre, Netherlands","at Green Leaf Restaurant apeldoorn

a lemonade foamy drink in the glass, drinking; pulling a glass of water that is lacking in taste and to bring home with something that should not be called beer",schavuitje
1108,Hidden Springs Zero F***s Given (ZFG),1.0,"Tampa, Florida","Pours a chill haze looking straw color. Thin white head with a bit of lacing. Smells crisp almost like a lager. Super thin mouth feel. Almost nothing to it but water, grain and something saying, Hey remember I have the slightest hint at bitterness. Worst beer I bought in Florida.",screigh
1109,Oskar Blues Steep Coast - Strata,1.3,"Longmont, Colorado","Tap at hollywood gardens in rochy pa, nice place with eye candy all over. Slight haze on pale. Mild BO nose, like old sex. Taste is certainly IPA but I doubt this owns up to double or imperial IPA fame. Yes, just another ubiquitous IPA, they all taste the same and I'm getting tired of this shit. I've had many IPA that were much more arrogant than this happy BS.",cheap
1110,Alpine Beer Company Windows Up,1.3,"Alpine, California","Clear pale on tap at hollywood gardens, nice place.  A little BO on the nose. Rude like old sex. Beginning is bitter ass. IPA ubiquitous is the term here. Almost nasty. Typical IPA, on style and what else can be said?",cheap
1111,Natural Light Naturdays,4.2,"St. Louis, Missouri","Clear light golden with a fast fading white head. Lovely nose of strawberry and semisweet lemonade and pale lager malt. Crisp cool flavor that’s got this nice lemonade undertone with fresh ripe strawberries and a crisp lingering clean finish. I know it’s a bull crap beer but damn it if it’s not tasty as hell. Refreshing, fruity, clean, crushable.",onceblind
1112,Block House Pumpkin Ale,1.5,"Pittsburgh                      , Pennsylvania",Soooo thick and sweet. Almost syrupee. I like sweet beers but this is over the top sweet. Maybe one as a dessert beer but beyond that no thanks. My wife bought me a case of this without us having first tried it (mistake). Ended up giving it to the neighbor.,natepgh
1113,Erdinger Alkoholfrei (Non-Alcoholic),0.8,"Erding, Bavaria","Visually, it pours beautifully, with a picture postcard head that lasts and lasts... and lasts... and... and... how odd.  The flavour is weakly watery, weakly bready, but somehow also highly unpleasant. I had a few sips and chucked it. This stuff is disgusting and unworthy of a serious review. I'm very surprised that the brewer of some of my all-time favourite beers is putting its name on this.",LovibondHopper41
1114,Half Hours on Earth Commissar Hazel,1.4,"Seaforth, Ontario",Can: Poured a light black color ale with a brown foamy head with limited retention and no lacing. Aroma of sour notes with some strong hazelnut syrup notes and lactose. Taste is a mess between some strong sour notes and sweet syrupy hazelnut notes with some lactose. Body is light with good carbonation. Awful mix of flavours.,Boutip
1115,Natural Light,4.3,"St. Louis, Missouri","The worst beer in the world? I think not! I really like how the head dissipates quickly. Also, I must mention that it has an extremely clean taste.",winstontaylorba
1116,Garrison Rise 'n' Stein Hefeweizen,5.0,"Halifax, Nova Scotia",One of the few wheat beers you can find in Canada. Super close to European kinds of beer. Far way better than trendy IPAs,vlad_dragula
1117,Jubel Urban Beer Cut With Elderflower,4.7,"Penryn, Cornwall","Had a pint of this drop in a pub In Bethnal Green. Maybe the best beer I have ever tasted. 

Perfectly refreshing and delicate.",BarrelTun40
1118,Jubel Urban Beer Cut With Elderflower,4.2,"Penryn, Cornwall","Draught at Tunes in The Dunes, Perranporth - served from Jubel Landrover Bar. Light and crisp lager with subtle floral taste - very good!",ilovebeer93
1119,Jubel Urban Beer Cut With Elderflower,4.8,"Penryn, Cornwall","Purchased on tap at The Approach Tavern in Mile End. I can’t say I have come across beer with Elderflower before, but this was delicious. A crisp lager with subtle elderflower notes. Dangerously refreshing!",thebarleyboy
1120,Jubel Alpine Beer Cut With Peach,4.4,"Penryn, Cornwall","Purchased on tap at The Queen’s Head in Holborn and was sceptical at first as I’m not a big fan of the Belgium fruit beers I have previously tried. However, this beer was light and crisp like a lager, but also had the refreshment of a fruit cider without the overpowering sweetness! I’ll definitely be back for more",thebarleyboy
1121,Jubel Alpine Beer Cut With Peach,4.7,"Penryn, Cornwall",Draught pint from Bristol Beach Club. A very light refreshing beer with subtle peach flavour.,ilovebeer93
1122,Curious Brew ,5.0,"Ashford, Kent","Lovely beer, crisp and refreshing, bought it because it was recommended in The Times, and can see why, definitely worth a try.",HopsPours39
1123,Jubel Urban Beer Cut With Elderflower,4.2,"Penryn, Cornwall","Pale in colour, floral and grape like aromas, quite dry and crisp on the mouth, finishes slightly sweet. Great refreshing lager.
",hneale93
1124,Off the Rail Paranoid IPA,4.6,"Forest Grove, Oregon","Off the Rail Paranoid IPA
Excellent well balanced taste. It was a Great tasting IPA that did not come up to your throat unlike other IPA's. You can actually drink this all night and would not feel the overfilling overhoppy overtrying to much critic conscious beer. Pissed off when the bar replaced it with that crappy Ninkasi garbage IPA",CiderMaestro41
1125,Leinenkugels Honey Weiss Bier,4.0,"Chippewa Falls, Wisconsin","Bardzo ładny czerwono - miedziany kolor. Trunek klarowny, przejrzysty, fajnie pracuje. Piana obfita, średnio trwała, gęsta. Aromat mocno chmielowy oraz cytrusowy. Cytryna, grejpfrut oraz limonka. W smaku trochę słodkie, intensywna goryczka, finish trochę żywiczny. Orzeźwiające, rześkie, dobrze pijalne, średnio wysycone. Dobra IPA, bez szału, ale wciąż lepiej niż gorzej.",k.szczypior.2002
1126,Rogue Outta Line,5.0,"Newport, Oregon",On tap at Horse and Cow. Awesome taste! Smooth & crisp citrus flavor with a soft fruity aroma and subtle hop to finish!,noswagg.chrisam
1127,Lagunitas Newcastle Brown Ale (US version),4.6,"Petaluma, California","This was my favorite beer for the past 20 years. When I saw the new packaging I bought it thinking nothing had changed. Lagunitas destroyed my favorite beer and I hate them for it.
",TheGrube
1128,Siren Soundwave,1.5,"Finchampstead, Berkshire","* Bottle 5.6%, west coast IPA. 
* Appearance is cloudy pale yellow with a white dissipating head. 
* Aroma is strong, bitter, malt, biscuit, citrus. 
* Palate is light body, medium carbonation, with very fine bubbles. 
* Taste is strong, hoppy, grapefruit, peach, mango.
* Finish is bitter, resin, drying finish.
* Overall bitter grapefruit, peach, mango and chalky taste, drying, 1/5.",MrJamesMcEwan
1129,Heineken,3.7,"Zoeterwoude, Netherlands","Had an Extra Cold Heineken at Schipol airport in Amsterdam. My god this beer tastes so much better in The Netherlands, I’m from Norway and bottled here it just doesnt taste the same. Was one of the best experiences I’ve had at an airport i was tired of traveling and a nice cold beer was the perfect thing. Was the best lager I’ve had on tap to date.",BeerMeister00
1130,Samuel Smiths Taddy Porter,1.8,"Tadcaster, North Yorkshire","Unfortunately, dark beer, light bitterness, far from the porter with character, Can carry a bag with golf clubs porter Żywiec",AleChalice25
1131,Fourpure / Devil's Peak Coastline ,0.5,"Bermondsey, Greater London","Utterly disgusting!!!! Tastes like a dodgy pint through lines that haven't been cleaned EVER..... Then with half a bottle of vinegar chucked in for good measure. Worst beer I have ever drank, avoid this stuff like the plague!!!!!!",BreweryTickers16
1132,Bud Light Lime-A-Rita,4.7,"St. Louis, Missouri","Lime-A-Rita has a fizzing-away head, a hazy, yellow-gray appearance, and some bubbles. The aroma is of pale malt and spicy fruit or margarita mix. Flavor is similar. This is very sweet, and Lime-A-Rita finishes medium sweet. RJT",ronaldtheriot
1133,Jubel Alpine Beer Cut With Peach,4.6,"Penryn, Cornwall","Love a few demi-pêche when in the Alps so knew I had to try this one. Pours light-golden with a good head. Strong peach aromas on the nose, light and citrus, very refreshing and not overly sweet so drinkable. Great stuff.",hneale93
1134,Graft Salt & Sand,0.6,"Newburgh, New York",Tastes like straight up low tide. I liked their lost tropic cider but this one is seriously one to avoid.,CaskMaster31
1135,Foreign Objects Green Galaxy,2.0,"New Paltz, New York","Pounder: Orange peel nose with significant DMS. Cloudy amber, medium head.  Orange peel, grass, DMS.Full body, moderate carbonation.",obguthr
1136,Night Shift Santilli ,2.0,"Everett, Massachusetts","Slightly cloudy yellowish and light. Bitter tasting, not many interesting flavors except a slight bitter piney after taste.

Was a draft from Waxy O'Connor's. I would not get this again.",overvolting
1137,Adnams Ghost Ship Alcohol Free,5.0,"Southwold, Suffolk","Just simply lovely ! The best 0.5 beer yet ( if you like citrus pale ale ) if not then you wont like it ! .the greatest thing next to the taste is is the texture and you get a head on it so it tastes , smells and looks like full alcahol beer  ! All of this with no hangover and you can drink it anytime any place 🤗🤗🤗 thank you Adnams .",benjynofx
1138,Half Acre Tuna,1.3,"Chicago, Illinois","Big pounder can from vintage for $3. Big blue sea colored can with yeller writing. Slight haze on pale in mug, with an interesting head. Smell is old rubber, maybe tuna? Just asking. Yes, rubbery and odd, wants to kick like a real IPA but just barely gets there. Veggie, did I say veggie? Oh yea, you know, that typical veggie cabbage taste thing going on. Straight up symplocarpus foetidus finish. There, you have it.",cheap
1139,Blue Moon Belgian White Ale,5.0,"Denver, Colorado","Easily one of my favourite beers! Served with a slice of fresh orange! 

On draught this beer is out of this world! Much better than it is from the bottle in my opinion.. with a creamy head when served on draught! 

Never fails to please!",adambailey19944
1140,Poretti 9 Luppoli India Pale Ale ,4.2,"Lainate, Italy","A lovely orange colour. Slightly sharp for an IPA but gets better with more tries. Overall a nice alternative to Italian lager.
",jrainey94
1141,Collective Arts Collective Project: IPA Project #10,1.2,"Hamilton, Ontario",Way over hopped. Too many hops combined together. Overwhelming aroma of pine. Bitter taste to it. Low carbonation. Hazy yellow pour with no head to speak of at all.,Raistlin
1142,Wychwood Hobgoblin IPA (Keg and Bottle),4.9,"Witney, Oxfordshire",De Labirratorium. En vaso de pinta inglesa de Ikea. Jugando a Oozi Earth Adventure. No puedo pensar en mejor forma de hacer una ipa inglesa. Lupulo fresco de caracter vegetal con notas terrosas y minerales. Ultrabebible y con retrogusto larguisimo,josanguapo
1143,Stone Moxee Gold IPA,1.4,"Escondido, California","From a $3 can from vintage, its clear gold of course. Smell is sweeter perfume hop flora. Taste is ubiquitous IPA. A plethora of nasty arrogant bitter preservative happy BS. Any alky content is amplified by the butyl rubber mouth coating effects of this brew. CARNAGE, CARP, CASH-STRAPPED, CASTIGATE, CASTRATED. Such a CATACLYSMIC, CATASTROPHE and a CAUSTIC CHAGRIN. All ends up being just a CHALLENGING & CHAOTIC, CHASTEN IPA CAPRICE.
",cheap
1144,Green Jack Orange Wheat Beer,1.5,"Lowestoft, Suffolk","Pours clear gold with a full snow-white head. Faint orange zest aroma. Watery orange taste. Not much body, and no aftertaste. Thin and insipid.",weirdbeered
1145,Northern Monk / J. Wakefield Patrons Project 15.01 Blues Run The Game,1.5,"Leeds, West Yorkshire","Burk från SB. Lilablå lätt disig vätska med litet ljus smutsvitt skum. Doftar lätt bärigt samt lite toner av diskmedel. Tunn smak som spretar mellan ipa, något konstigt sött samt en liten bärighet. Odrickbart skräp.",johancederholm
1146,Jubel Alpine Beer Cut With Peach,4.5,"Penryn, Cornwall","Initial hit of peach transitions into a light, malty lager which is surprisingly refreshing and easy to drink without being too sweet. Well-balanced beer that I will definitely be buying again.",AleTeam40
1147,Jubel Alpine Beer Cut With Peach,4.2,"Penryn, Cornwall","Light-gold colour, thin head, strong peach aroma and well integrated peach taste with lager undertones. Very well balanced and easy-drinking summer craft beer",kenningtonhopking
1148,Bud Light Lemon Tea,4.7,"St. Louis, Missouri","Bud Light Lemon Tea has a thick, white head, a clear, golden appearance, with some bits of glass lacing. The aroma is of spice candles, wax, herbal potpourri, and lemon, with some pale malt. The flavor is similar, with a medium body. Bud Light Lemon Tea finishes mostly dry. They did a great job with it, although it's not light. RJT",ronaldtheriot
1149,Locavore Lilly Hammer IPA,1.5,"Littleton, Colorado","Can (BB Sep 23, 2019).

Head is initially averaged sized, frothy, white, mostly diminishing.
Body is light amber.

Aroma is lightly malty (grain), lightly hoppy (apricot), with notes of butter, plastic, carpet, onions.

Flavor is heavily sweet, lightly to moderately acidic, lightly bitter.
Finish is moderately sweet, lightly to moderately acidic, moderately bitter, unclean.

Medium to full body, syrupy/watery texture, lively carbonation, moderately alcoholic.

Lots of horrific off notes completely ruin the nose, and it's syrupy and overly sweet (and sour) in the mouth, with a very dirty aftertaste (gag-inducing). A shockingly bad drain pour.",Ernest
1150,Budweiser Select,5.0,"St. Louis, Missouri",Love this beer. Been drinking it since it was in skinny cans. Great calorie to alcohol ratio. Its my goldilocks. Budweiser boats me and bud light is well bud light. Select is just right,WortTun34
1151,Marz Diliner Weiss,0.7,"Chicago, Illinois","Pours a golden color with a decent white frothy head. Smells of vinegar and musty spice cabinet. Unpleasant taste of white vinegar, dill, and musty red pepper flakes. Overall a yucky ""pickle beer"" that would have been kind of funny and enjoyable if it came in a 50ml ""shooter"" so you could say you've tasted it, and then moved on with your life, but it's definitely a challenge to finish a 12oz can, and I really have no idea what to do with the other 3 beers from the 4 pack (maybe give them as ""gag gifts"" to people I don't like?). Marz should just stick to the Double IPA style that they do so well with.",messiah
1152,Stone Tropic of Thunder,1.7,"Escondido, California","Why does everything have to be bastardized by IPA? Its all one style but with 32 shades and the same connotation as the book. Isn't 32 different kind of IPA enough? Come now. Clear pale from $2 can. Little head. Smell is rude ass dull IPA viscous perfume. Taste is as expected, IPA laced beer. Does have shades of a difficult domestic bitter astringent pils. Not many manners here but fer sher I thot it would be a little more impressive. Pretty good co2 but not enough to distract from the up front hops.",cheap
1153,Meissner Schwerter Kellerbier,5.0,"Meißen, Saxony","It is one of my favourite German beers, I like the taste and the foam it produces when in beercup.",AllGrainMuse40
1154,Arrogant Enter Night,1.8,"Escondido, California","Ok, got this pounder can from vintage for $3 but it doesn't say arrogant on it. Olfactory of mild hops. You would think if it was arrogant, it would be big alky content. Its not and you would think it would tuff on the taste buds, well it is. Yes, it has a rubbery feel to it like so makny mild veggie IPA, perhaps more like a session IPA, heheh. Well, anyway, except for that stupid ass IPA effect,  it does have the piercing typical bite of a pils to it. Well, tho not of the real pils, like that of the old country pils, but certainly like the straight up domestic varieties that say they a wannah bee real old country civilized pils but really isn't. What else can be said? Except that this beer does not rise to the occasion of a real arrogant stone beer. However, its really not a pils and its more like an india pale lager, HAH!",cheap
1155,Natural Light Naturdays,5.0,"St. Louis, Missouri","Crisp, fresh, fruity, and refreshing! The strawberry lemonade pairs perfectly with the watery Natty to create an amalgam of taste and freedom that defines a perfect summer day.",BineChalice32
1156,Wieckse Rosé,0.5,"Zoeterwoude, Netherlands","Tastes like when your mum made a glass of black currant sqash, but made it far too week. And then chucked one of those blue urinal blocks in it",adamwh
