,Beer Names,Rating,Locations,Reviews,Users
336,Galahad Export,5.0,"Atherstone, Warwickshire","Refreshing and excellent, let me set the scene. A long day of work, you come to your fridge to have a quiet night in, and the G'had stares you back. After a first sip of liquid gold runs down your throat, the sensation of the worlds best premium lager kicks in, with a rustic taste and a sense of ""bring the outdoors in"", a well rounded refreshing beer. This is water 2.0",DraftLiquids57
337,Brooklyn Special Effects,0.6,"Brooklyn, New York","Amber clear with a one finger wide head.
Foul smell. The beer tastes like a full trash can smells. Disgusting!",ophone
338,Ashton Pub Amber Ale,1.5,"Ashton, Ontario","Canned. Clear brown body, small beige head. The aroma has metal and malt. The tastw is metallic with a hoppy finish.",Tranquillity
339,Lagunitas Newcastle Brown Ale (US version),0.9,"Petaluma, California",This is a rating for the U.S. brewed version... Watery since brewing was moved to Cali. Not the same Newcastle. What a shame.,MobileBayBeerGuy
340,Mondo Little Victories,1.3,"Battersea, Greater London","Nov 2019. 330ml dark bottle from BeerWulf for less than £2. Urgh, this is not my thing. Mucky murky hops and malt - everything blurry and blurred. It's like drinking a mess. There's ingredients here, but they don't combine to produce anything meaningful or pleasant in my mouth. Each to their own, but this presents as a mess to me. It's drinkable, but its not the best.",SilkTork
341,Beck's,4.9,"Bremen, Bremen","Purchase a 12 pack from my local Rite Aid. Thick white head on top of a pale yellow body. It's really bubbly. It smells sweet, kind of like sweet corn. It's a touch on the dry side but otherwise it's a perfect lager. it's slightly sweet with no hoppy bitterness there's a slight aftertaste I find unappealing but other than that a fine beer",camay1997
342,Heineken Premium Light,3.2,"Zoeterwoude, Netherlands","Golden, small, aroma is malt, grain, sweet, bit of sweaty feet, taste is malty, sweet, grain, heineken. Meh",SVD
343,Ludlow Black Knight,1.3,"Ludlow, Shropshire","The black knight they called it. I’d heard the stories, the townsfolk warned me but destiny will determine your fate one day. It was darker than dark, I stared into my glass like the abyss it was and the abyss stared into me. Had a roast nutty finish without hints of citrus, head was minimal but present. I’ll never remember the ml but I’ll always remember how I felt that day.",heroesnever69
344,Bud Light,2.8,"St. Louis, Missouri",Pours a clear pale yellow with a white head. Very light grainy aroma. Light sweet rice and grain flavors. Pretty plain and ordinary. Ok but nothing special.,jsporrer
345,Columbus Brewing Go Kart Ghost,1.7,"Columbus, Ohio","Hahah, name on this $2 bottle makes me want to pop it and chug it. Well, here goes. One big giant chug from this 60F bottle is decent. Poured rest into a mug. A fancy mug yet it has a clear side for viewing. Some off aroma in the nose. Quite a blast. Pretty good carbonation with some ill ale effects but it never tries to be an IPA and I'm glad about that. Next to tap, a craft beer is so much better in a bottle, forget the cans mahfah. Not too bad overall beer tasting experience thank you columbus. Yes, an aye pee aye I can tolerate. Dude.",cheap
346,Hop Valley Bubble Stash,1.6,"Eugene, Oregon","As others have stated, it’s got a weird melon taste to it. It may be your thing but I’m personally not a fan.",Beersmoke4
347,Coors Light,4.2,"Golden, Colorado","Nothing tops a cold Coors Light on a hot sunny Florida day. It’s like when someone’s cums on the roof of your mouth. Also, it’s a beautiful party drink, a cheap beverage, that is top tier for shotgunning and other party games. Very rare you will get ID if you are underage at a store.All in all, liquid gold. Like a marenellies that went to private school.",bigdickivan
348,Rivet Lager,5.0," , North Rhine-Westphalia","Nothing like coming home after a long day and cracking on the oven for a nice easy preheat. Once you're cooking chuck that 6 pack of Rivéts inside with your nearest beer thermometer, when you've ticked over 27°C, you are ready for a delight.",LovibondRater58
349,Beach Bum Blonde Ale,5.0,"St. Louis, Missouri",Normally not an IPA guy but this beer totally changed my opinion!! After I took a sip of this beer I knew it was 100% time to slay with my IPA. This is absolutely perfect if you like your beer like you like your women; blonde.,mcaton
350,Bud Light Lime,4.0,"St. Louis, Missouri","Ok y'all hear me out.  Bud light is gross, Im not going to sit here and defend it. Its watery and overall just gets doesn't get you drunk quick enough. But bud light lime is on a whole new level. pull one of these frosty boys out the fridge and suddenly you feel like you're sipping a corona extra with the perfect beer to lime ratio. This stuff is legit. it is classy? no. Is it nice? no Is it 13.99 for a pack? Yes. is it the best beer you can get for this price? 100%",LagerTicks58
351,Bud Light,3.5,"St. Louis, Missouri","I have no idea why people hate on the ole bud light, I get it, the forbidden syrup content is low, but it is a nice refreshing light beer. Great for parties to shot gun, beer pong and flip cup. This beer is a nice basic light beer, and people try to expect something that a light beer doesn’t have.",jpuch
352,Natural Ice,3.7,"St. Louis, Missouri","Overall, Natty Ice is a decent beer; with having a higher alcohol content of beers it has a basic but good beer taste. Plus, the can is a sick blue and black, giving people a way to know you have big balls. It’s cheap as dirt but makes you squirt.",jpuch
353,Natural Ice,3.6,"St. Louis, Missouri","The ultimate party beer is my description of this sacred brew. Cheap, easy to drink, and 5.9% alcohol per serving. Now that is a powerful drink that truly gets the blood flowing.",bigdickivan
354,Budweiser,4.7,"St. Louis, Missouri",Just a simple beautiful taste of freedom. This beer ain’t to expensive but gets the job done with a 5% content of the forbidden syrup.,jpuch
355,Molson XXX,4.2,"Montréal, Quebec","I first tried this years ago. The gold triple X sitting upon it's dark backdrop was daring and ominous. Years later after many disappointing tasting experiments I got XXX again. It has a strong, dark, rich flavor and a pleasant aftertaste.",mewpie
356,Miller Lite,4.0,"Milwaukee                       , Wisconsin","A good tasting beer that resembles one of a Coors Light. It has a light beer taste, and is quality when enjoyed cold. Also a great beverage for party games or just to enjoy with the boys on a boat.",bigdickivan
357,Michelob Ultra,4.8,"St. Louis, Missouri","It does not get much better than a Michelin Ultra. The smooth tasting beer makes it perfect to get a party going, or to even have a SSS function. A Cold Michelob Ultra “hits different” than other beers. It has a unique skinny can, with the same 12 Fluid Ounce amount of beer tasting goodness as it’s opposing brews, while still having a one of a kind taste that can only be described as “Yeah that’s a Michelob alright, can I have another?”",bigdickivan
358,Bud Light Lime,4.5,"St. Louis, Missouri","The Bud Light Lime has a quality lime taste and is one of my favorite beers. It has a taste resembling a Corona with its lime, and makes the other lime tasting beverages seem shitty, like the White Claw Natural Lime. For a man who enjoys his Beer, this will always be a go to for me.",bigdickivan
359,Florisgaarden Honey,0.5,"Melle, Belgium","Bottle of 33cl, in a Tumbler glass; from the fridge.

Why do I keep tasting beers of this Florisgaarden brand ? I do not know.",Syfher
360,Cape May The Bog,1.0,"Cape May, New Jersey","Very pungent aroma, and very fruity to the taste. My disclaimer is I am not a big Cranberry fan, but this was overkill and partly sour",cjgaertner
361,Fosters (UK),5.0,"Manchester, Greater Manchester","One of the best and most easy To drink beers i ever had, on of the reasons i fly back to London again and again... cant get it here in DK..
Going back monday, so you better Stock up on the pubs..🤣",BrewSensei139
362,Grand Canyon Sunset Amber Ale,1.3,"Williams, Arizona","I have tried this beer on three different occasions and each time it immediately foams up to the point of aggravation. it is so annoying that i will not endure its fairly good flavor to suffer the indignities of this foaming menace when there are so may other beers that rise to the same flavor level and can actually be drunk within the first ten minutes of pouring it, and forget about trying to drink it straight from a bottle. That is mission impossible>",CiderMaster40
363,Spartan Son of Zeus,0.5,"Bermondsey, Greater London","Ap at brewery. Copper pour, sparse head. Malty aroma, raisins. Light sweet taste, more raisins. 3.6% mild light but full",stevoj
364,Minhas Lazy Mutt Farmhouse Ale,4.6,"Monroe, Wisconsin",Not as good as a Spotted Cow but the price is great and a good farmhouse ale. Has a slight wheat taste.,LagerChecker34
365,Deschutes Only Slightly Exaggerated IPA,1.5,"Bend, Oregon","Bottle from vintage. Aroma is a little off IPA. Taste, well, what do you expect? Just another rude ass APA that wants to be IPA. There are so many IPA out there, they've taken the place of the cheap american pale lager for the ubiquitous cheap american beer. There must be a brahzillion of them out there. What else can be said?",cheap
366,Shepherd Neame 1698 ,5.0,"Faversham, Kent",Highly recommended for ex military stuff. Recommendations by airborne. 😃😃😃,BubbleMaster40
367,The Duck-Rabbit Brown Ale,1.2,"Farmville, North Carolina","Got as a gift 6-pack. Sour, thin, over-carbonated. Has an “enjoy by” scale but nothing indicated. Committed sacrilege: after three sips I poured the rest out. Maybe I’ll use the others to cook brats.",Intladvr1
368,Miller Genuine Draft (MGD),4.4,"Milwaukee                       , Wisconsin","Great hot day refreshing lager,goes down smooth as.serve cold can't go wrong. Mmmm",wootwoot83
369,Gritty McDuffs Lions Pride Brown Ale (Best Brown Ale),5.0,"Portland, Maine",Very good brown ale. Big surprise to read the low alcohol amd calorie count. It is a very flavorful brown ale.,jfsebastian
370,New Holland Dragon's Milk - White,1.5,"Holland, Michigan","Can from Total Wine in Sunnyvale, CA. Aroma is vanilla, artificial syrup, light malts. Taste is cream ale, vanilla, more artificial. Def not a stout...more of a cream ale which I strongly dislike.",tightslice
371,Bell's Double Two Hearted Ale,2.1,"Comstock, Michigan","12oz bottle.  Pours a cloudy copper-gold with a tiny beige head.  Aroma is pine, resin, earth, orange, caramel, some grapefruit, and a little dough.  Taste is syrupy-sweet caramel, orange, pine, metal, grapefruit, earth, some minerals, some biscuit, and some yeast.  Moderate bitterness that grows over time.  Boozy - very boozy.  Full body.  Moderate carbonation.  Syrupy-sticky mouthfeel.",tapefuzz
372,Camden Town Arch 55 Plum Sour,0.8,"Ponders End, Greater London","Sour session lager med blommer

Det hænger ikke sammen, de lidt umami lager malte og de overmoden blommer hænger ikke sammen. 
Mangler noget vildt gær, og det syrlige spark kommer kun ved 1. Dyk i glasset. Til sidst smager den faktisk af bræk, syren kommet simpelthen frem på den helt forkerte måde. Den er livlig i kroppen, og hælder gullig væske.",Kronhjort1996
373,Shiner Holiday Cheer,4.9,"Shiner, Texas","Fantastic. Peach inside, good flavor. Definitely it worth a 100 try. You will never get disappointed.",beer3000
374,Perlenbacher Lager ,3.7,"Neckarsulm, Baden-Württemberg","Nice beer. Even nicer when it's really cold. Bit gassy, but 4 or 5 of them is really nice.",BarleyScout55
375,Northern Monk Patrons Project 14.05 King - Grapefruit Soda IPA,1.4,"Leeds, West Yorkshire","440ml can at We Brought Beer, Tooting.  Murky golden.  Aroma of sweets, grapefruit, and weird soft drink.  A rare miss for NM.  Overly sweet and saccharine.  I’m not sure what they were going for.",Beese
376,North High Grapefruit Walleye,1.5,"Columbus, Ohio","$2 orange can as pictured. First thought? Who wants that terribly bitter feel without big ABV? Taste is big bitter rubber veggie cabbage. Some decent co2 if you search for it. Yea, there you have; another rude ass on style bitter IPA, must be a gahzillion out there and they all taste the same; nasty. Continuing session, radel radly runs right over the roughnecks. Terribly on style for a light IPA, almost APA.",cheap
377,Harboe Dansk Julebryg,5.0,"Skælskør, Denmark",Rigtig dejlig juleøl til billige penge! En sikker vinder hvert år til jul:),FrederikThordal
378,Kaltenecker Chilli Pivo,1.0,"Rožňava, Slovakia","On tap @ Főzdefeszt. Dark amber colour with small and disappearing bubbly off-white head. Malty nose with some vegetables. Taste of an average mass produced lager with unpleasant heat. No chilli or paprika taste, just the heat in the throat. Crap.",pityu
379,Mothership Hypergalactic,1.0,"Nunhead, Greater London","* Can 6.4% IPA
* Appearance is cloudy honey colour with a white disapatting head. 
* Aroma is toffee, pine and skunked hops.
* Palate is heavy body, oily, medium carbonation, with very fine bubbles. 
* Taste is caramel, lemon, and a resin finish.
* Finish is resin and drying. 
* Overall skunked hops, not very nice 1/5.",MrJamesMcEwan
380,Surly Furious,1.8,"Minneapolis, Minnesota",Sampled in a blind taste-test on 11/11/2019.  Pours a honey color with a sparse head and average lacing.  Very hoppy.  Bitter.  Sour.  Spew.,o_Merlin_o
381,Grain Belt Premium,1.1,"New Ulm, Minnesota",Sampled in a blind taste-test on 11/10/2019.  Pours extremely light - like yellow colored water.  Very aqueous.  Zero head.  Wet leather aroma.,o_Merlin_o
382,Sierra Nevada Sierraveza,1.2,"Chico, California","Tasted in a blind taste-test on 11/9/2019. Zero aroma - literally nothing. Looks like yellow colored water, it's so faint.  Velvety head, with zero lacing.  Spew.",o_Merlin_o
383,Pedavena Birra Dolomiti Pils 4.9,0.5,"Pedavena (BL), Italy","Wygląd: Jasne złoto, przejrzyste bez piany.

Aromat: Słodowy, mineralny, trochę mokry karton.

Smak: Też słodowy i kukurydziany (kukurydza w składzie ? skąd?) lekko wytrawne, goryczka nawet jest jakaś tam.

Ogólnie: Nudy na pudy, smakuje jak wszystkie lagery.",meridian
384,Steel Reserve Alloy Series Spiked Watermelon 211,4.7,"Milwaukee                       , Wisconsin","Steel Reserve Alloy Series Spiked Watermelon (285 calories) has a thin, white head, a clear, bubbly, and a rose appearance, with some glass lacing, believe it or not. The aroma is of citrus acid, maybe watermelon, pale malt, & sourness (?). Flavor is similar, with lots of sweetness & no bitterness. Mouthfeel is medium, and Steel Reserve Spiked Watermelon finishes medium dry. RJT",ronaldtheriot
385,Dogfish Head 75 Minute IPA (Cask/Bottle),1.5,"Milton, Delaware",Definitely an IPA. Total hop bomb. Not at all like Dogfish 60 and Dogfish 90,malts-a-meal
386,Blue Moon Belgian White Ale,1.4,"Denver, Colorado",tastes like a belgian white was diluted 50/50 with a coors. sweet smelling cheap wheat and corn with old orange peels or orange flavoring. flavor is the same - sweet brew of cheap wheat and corn with weird orange flavor - not getting nice yeasty funk or spice or anything youd expect from a good white ale. cloying orange flavor and stale grain aftertaste - will avoid...,beerbomb
387,Hamms,3.9,"Milwaukee                       , Wisconsin","One of my favorite cheap brews. A very nice, crisp refreshing beer. My only complain is that it could be a bit less sweet, but otherwise I definitely enjoy kicking back and enjoying some nice cans of Hamm's. Definitely a nice classic American lager.",moomin
388,Miller High Life,4.0,"Milwaukee                       , Wisconsin","People can trash this beer all they want, but for what it is, I absolutely love it. It's a classic American blue-collar lager and it's a crisp refreshing beer. Decent sweetness, light bitterness, decent body, nice pale golden color. I've gotta say it's probably my favorite macro brew.",moomin
389,New Glarus Spotted Cow,4.7,"New Glarus, Wisconsin","A classic delicious Wisconsin beer, maybe my favorite beer. Very nice refreshing ale with bright fruity notes and a decent bitter bite. Perfect with bratwurst during a Packers game!",moomin
390,Vibrant Forest Stone Sap - Juicy India Pale Ale,1.9,"Hardley, Hampshire","Mętne z dużą ilością goryczki, która przerasta/zabija smaki i aromaty owocowe. Zapach ciekawy z nutami owoców tropikalnych.",torrc
391,McEwan's Champion,5.0,"Bedford, Bedfordshire","Bought this beer from Tesco superstore in Nottingham , you get 4 bottle for £6, you just truly cannot believe the lovely smooth taste of this ale when you consider the rather huge strength, 7.3 %..!! It tastes more like a smooth 4.5 % ..sweet after taste on the tongue. I'm a huge fan of this champion beer from guys who have proved they know there oats :)",ng51guy
392,Leelanau Petoskey Pale Ale,1.6,"Lake Leelanau, Michigan","Surprised I haven’t rated this. This was a 2016 bottle shared by pat. Brown color with medium to full head. Notes are plastic, dentist office, latex, and other infection. Foodery should be ashamed they sold this to my friend",PhillyCraft
393,Heineken,4.2,"Zoeterwoude, Netherlands","Cerveja levemente amarga, mas suave. Não beber muito gelada para poder perceber o verdadeiro sabor.",leonardocouto
394,Taurus Pear Cider,5.0,"Atherstone, Warwickshire","Taurus, Taurus, Taurus that is my life now, I aspire to be the worlds greatest Taurus drinker, I love it. I am always drunk, because Taurus is this magical drink which has supernatural powers. you drink this, you will then become a top shagger . simples. if you thought jay from inbetweeners was the ultimate clunge magic, you're wrong with a pear Taurus in your hand the birds can't turn you down, in come fly with me Taaj had ""pussy waggon"", and in real life you can have the pussy waggon"" its just car full of Taurus.

 I love Taurus, you love Taurus, we all love Taurus",PilsnerGuide144
395,Taurus Dark Fruit,5.0,"Atherstone, Warwickshire","I am a consistent Taurus drinker ! I have Taurus flowing through my veins, its in my blood stream at this point and I love it ! when I wake up in the morning with my morning wood, I'm thinking about Taurus. 50p a 440ml can which is 4% (however I prefer the 4.8% pear cider, that's the one which turns me on), if you need a good shag just bring 20 of your finest Taurus to the party and the bitches will be drooling. others whom rate the Taurus lowly are on the spectrum, its as simple as that. if you are in need of simple yet complex drink whilst shagging birds Taurus is for you !
",PilsnerGuide144
396,Great Lakes Ohio City Oatmeal Stout,1.7,"Cleveland, Ohio","This just tastes funny. Sort of a watery, kinda minty, something-is-off flavor, kinda like sour milk. I don't know if it's because my palate is wrecked from just drinking a different beer (an inoffensive if not particularly good brown ale), or if I'm using the wrong glassware (teku glasses aren't the best for stouts), or what. Not the glassware, poured it into a dimpled mug and I'm getting the same thing. Maybe there's something wrong with this one, but from what I can tell, this is a bad beer.",EvanFriend
397,Oakham Green Devil IPA,1.5,"Peterborough, Cambridgeshire","Was on offer in the local so tried it. This isn’t a good beer. No depth, it’s over sweet not tropical. So disappointed, it’s like an artificially flavoured cheap lager!

Sorry but I bought 4 of these and be nothing else to drink!",SampleScout19
398,Deschutes Botanic Ale,1.6,"Bend, Oregon","Bottle on clearance at bowsers, cheap. Cloudy pale, aroma of some kindah spice. Odd weird unique spice thang on teh uptake, but not real bitter. Yes, quite unique, almost like trying to like medicine. Whew. Difficult. A little too different I'd say. Whew. Perhaps just a tad of warming sensations from the ginger. Not sure about any lime tho. Would not repeat, repeat, would not repeat, heheheh.",cheap
399,Queen City Yorkshire Porter,1.3,"Burlington, Vermont","Thin bodied, almost no foam or head, zero lacing and only a hint of the characteristics of what is typically a rich and full-bodied style. Add to this the unfriendly service at their South Burlington, VT 'taproom' in the brewery, and I recommend you avoid this one.",TigerSoul
400,Wild Beer Nebula,1.8,"Shepton Mallet, Somerset","Keg at We Brought Beer, Balham.  Hazy straw with a white head.  Aroma of wet grass, some over-ripe fruit and that wet dog note.  Flavour is very sweet and caramelly, and I’m getting quite a note of skunked hops on this.  Not sure if that’s deliberately to make the beer sweeter.  However, it seems Wild might be missing the point of NEIPAs and their sweetness.  Flavour is again sweet, before there’s a rush of slightly metallic bitterness, followed by a lingering flavour, not unlike that which you might get after rapidly consuming a whole tube of fruit pastilles.",Beese
401,Jester King Le Petit Prince Farmhouse Table Beer (Batch 1-10),5.0,"Austin, Texas","Light yellow liquid. Scent of hay, herbs and yeast. Light mouthfeel with stale tones. Barrels, grass and resin acid.",SourScout57
402,Goose Island So-Lo,5.0,"Chicago, Illinois","Genius. A delicious light beer that downplays the sickly maltiness and emphasizes citrus bitter hops. And it’s 3.0!  In the day of 8.0 beers that being on an instant headache, this beats out all the season beers. Only downside, hard to get drunk if that’s your thing",LocalLove53
403,Wild Beer Epic Saison,1.8,"Shepton Mallet, Somerset","* Bottle 5% Farmhouse Ale.
* Appearance is hazy pale gold with an off-white dissipating head. 
* Aroma is earthy, bread, and spicy.
* Palate is medium body, oily, high carbonation, with very fine bubbles. 
* Taste is dry, musty, bittersweet. 
* Finish is very dry and bitter.
* Overall a musty, bitter, tangerine taste with a chalky mouthfeel, high carbonation 1.8/5.",MrJamesMcEwan
404,Iron City Light Mango,3.9,"Pittsburgh                      , Pennsylvania",Nice light fruit flavored beer. Only 95 cal and minimal carbs. It uses artificial sweetener but has an authentic taate. Very nice refreshing warm weather beer.,LuvMyBeer64
405,Harboe Premium Bear Beer Wheat,1.0,"Skælskør, Denmark","Aroma- bananas, as typical for wheat beers
Taste - horrible, not even like bananas, fuj, rusty in mouth 
Don’t recommend",koblih
406,Miller Genuine Draft (MGD),4.0,"Milwaukee                       , Wisconsin","Some pretty harsh scores on this one, but I like it a lot. Especially in a glass straight out of the freezer, makes me feel like I'm actually at a bar. A decent replacement for actual draft.",drrollinstein
407,Rolling Rock Extra Pale,5.0,"St. Louis, Missouri","My go to beer. Better than any of the basic light beers, and cheaper too. Maybe not the best beer ever, but its 5 bucks a 6 pack.",drrollinstein
408,Miller Lite,3.9,"Milwaukee                       , Wisconsin",One of the best cheap beers and low in calories. Good for sporting events and whenever you want just a casual drink.,eecowboy
409,Epic Big Bad Baptist - Quadruple Barrel,1.8,"Salt Lake City, Utah","Pours a pitch-black coloration with a medium, creamy, mocha-colored head. Smells of roasted, caramel malt, coffee, dark chocolate, lighter coconut and just a hint of an offensive, tart, soapy note that intensifies upon swirling. Taste is dominated by that offensive tart and soapy note that drowns out all of the nicer coffee and chocolate notes in the background. Finishes on a sour note, with some soap lingering in the aftertaste. Full mouthfeel with a medium body and carbonation.

I absolutely loved Big Bad Baptist and Big Bad Baptista, so I was really looking forward to this beer, which I kinda saved for a special occasion, so it came as huge disappointment to me to find it infected and undrinkable, had to darinpour it. My release number is 12 and there apparently have been other reports of infection with this release number, so avoid it like the plague.",snowcrash000
410,Whitewater Midnight Stout,5.0,"Foresters Falls, Ontario","Tasted great, i love the smell of it and taste and it went perfectly with my dinner.",MashRater53
411,Bruery Terreux Sour in the Rye,2.0,"Anaheim, California",Brutal. Super sour apple cider vinegar most with some berry notes. Lightly sweet and very tasty. Some saltiness in the fade. Nit m jam. And not for a sour newbie.,freekyp
412,Petoskey Juicy,2.0,"Petoskey, Michigan","Well…yuck.  Those two words are never put in proximity when you rate Blatz.  Think about it.  When doling out the adjectives for that “Blessed Pleasure Elixir”, you are more likely to come across “magnificent”, “wonderful”, and “shaved pussy-like”.  Think about it.  Or not.
Although this stuff does have alcohol, that’s about all I can say with positivity.  Don’t spend your life in sartorial conformity.  Get a Blatz.  Get it now.  Drink it down.  Become one with the cool people.  Trust me. You should.  You will.  And soon you will be suffering the contortions of hell like the rest of us.  Do it.  Now….or else I will come over to your house and treat it like my own…..shitting on the floor, banging your daughter, starting random stuff on fire.  You get the picture.  Now get your bad self a Blatz.
",vomit
413,Northern Monk Patrons Project 17.05 Neale's Sour (Purple) Grapes Five Fruit Gose,2.0,"Leeds, West Yorkshire","6/20 very purple, not salty, weird mix of berry flavours, didn't work for me - just doesn't taste good",rob19a
